<?xml version="1.0" encoding="UTF-8"?>

<racine xmlns:xsi="http://www.w3.org/2001/XMLSchema-instance"
        xsi:noNamespaceSchemaLocation="./bp.xsd" >
  
  <batiment>
    <nom>Test</nom>
    
    <piece>
        <nom>piece7</nom>
        <murs>
            <coordonnees>2;4,0;4</coordonnees>  
            <coordonnees>0;4,0;0</coordonnees>
            <coordonnees>0;0,6;0</coordonnees>
            <coordonnees>6;0,6;4</coordonnees>
            <coordonnees>6;4,4;4</coordonnees>             
        </murs>
        <sortie>
            <coordEtNomPieceConnexe>3;4,piece5</coordEtNomPieceConnexe>
        </sortie>
    </piece>
    
    <piece>
        <nom>piece1</nom>
        <murs>
            <coordonnees>4;5,0;5</coordonnees>  
            <coordonnees>0;5,0;0</coordonnees>
            <coordonnees>0;0,7;0</coordonnees>
            <coordonnees>7;0,7;5</coordonnees>
            <coordonnees>7;5,6;5</coordonnees>             
        </murs>
        <obstacles>
            <obstacle>
                <nom>tablereunion</nom>
                <coordonnees>2;2,5;2</coordonnees>  
                <coordonnees>5;2,5;3</coordonnees>
                <coordonnees>5;3,2;3</coordonnees>
                <coordonnees>2;3,2;2</coordonnees>
            </obstacle>      
        </obstacles>
        <sortie>
            <coordEtNomPieceConnexe>5;5,piece2</coordEtNomPieceConnexe>
        </sortie>
    </piece>
    
    <piece>
        <nom>piece2</nom>
        <murs>
            <coordonnees>3;0,0;0</coordonnees>  
            <coordonnees>0;0,0;7</coordonnees>
            <coordonnees>0;7,3;7</coordonnees>
            <coordonnees>3;7,3;5</coordonnees>
            <coordonnees>3;5,4;5</coordonnees>
            <coordonnees>6;5,6;3</coordonnees>
            <coordonnees>6;1,6;0</coordonnees>      
            <coordonnees>6;0,5;0</coordonnees>        
        </murs>
        <obstacles>
            <obstacle>
                <nom>bar</nom>
                <coordonnees>0;3,1;3</coordonnees>  
                <coordonnees>1;3,1;7</coordonnees>
                <coordonnees>1;7,0;7</coordonnees>
                <coordonnees>0;7,0;3</coordonnees>
            </obstacle>      
        </obstacles>
        <sortie>
            <coordEtNomPieceConnexe>4;0,piece1</coordEtNomPieceConnexe>
            <coordEtNomPieceConnexe>5;5,piece3</coordEtNomPieceConnexe>
            <coordEtNomPieceConnexe>6;2,piece4</coordEtNomPieceConnexe>
        </sortie>
    </piece>

    <piece>
        <nom>piece4</nom>
        <murs>
            <coordonnees>0;1,0;0</coordonnees>
            <coordonnees>0;0,1;0</coordonnees>
            <coordonnees>3;0,4;0</coordonnees>
            <coordonnees>4;0,4;9</coordonnees>
            <coordonnees>4;9,1;9</coordonnees>
            <coordonnees>1;9,1;5</coordonnees>
            <coordonnees>1;5,0;5</coordonnees>
            <coordonnees>0;5,0;3</coordonnees>
        </murs>
        <obstacles>
            <obstacle>
                <nom>comptoir</nom>
                <coordonnees>4;2,2;2</coordonnees>
                <coordonnees>2;2,2;3</coordonnees>
                <coordonnees>2;3,3;3</coordonnees>
                <coordonnees>3;3,3;7</coordonnees>
                <coordonnees>3;7,4;7</coordonnees>
                <coordonnees>4;7,4;2</coordonnees>
            </obstacle>
        </obstacles>
        <sortie>
            <coordEtNomPieceConnexe>0;2,piece2</coordEtNomPieceConnexe>
            <coordEtNomPieceConnexe>2;0,piece5</coordEtNomPieceConnexe>
        </sortie>
    </piece>

    <piece>
        <nom>piece3</nom>
        <murs>
            <coordonnees>1;0,0;0</coordonnees>   
            <coordonnees>0;0,0;4</coordonnees> 
            <coordonnees>0;4,3;4</coordonnees>
            <coordonnees>3;4,3;0</coordonnees>
        </murs>
        <sortie>
            <coordEtNomPieceConnexe>2;0,piece2</coordEtNomPieceConnexe>
        </sortie>
    </piece>
    
    <piece>
        <nom>piece5</nom>
        <murs>
            <coordonnees>0;0,4;0</coordonnees>
            <coordonnees>4;0,4;1</coordonnees>
            <coordonnees>4;3,4;4</coordonnees>
            <coordonnees>4;4,11;4</coordonnees>
            <coordonnees>11;4,11;6</coordonnees>
            <coordonnees>11;6,8;6</coordonnees>
            <coordonnees>6;6,4;6</coordonnees>
            <coordonnees>4;6,4;8</coordonnees>
            <coordonnees>4;10,4;15</coordonnees>
            <coordonnees>4;15,3;15</coordonnees>
            <coordonnees>1;15,0;15</coordonnees>
            <coordonnees>0;15,0;6</coordonnees>
            <coordonnees>0;6,-2;6</coordonnees>
            <coordonnees>-4;6,-6;6</coordonnees>
            <coordonnees>-6;6,-6;4</coordonnees>
            <coordonnees>-6;4,-4;4</coordonnees>
            <coordonnees>-2;4,0;4</coordonnees>
            <coordonnees>0;4,0;0</coordonnees>        
        </murs>
        <sortie>
            <coordEtNomPieceConnexe>2;15,piece4</coordEtNomPieceConnexe>
            <coordEtNomPieceConnexe>-3;6,piece6</coordEtNomPieceConnexe>
            <coordEtNomPieceConnexe>-3;4,piece7</coordEtNomPieceConnexe>
            <coordEtNomPieceConnexe>4;2,piece8</coordEtNomPieceConnexe>
            <coordEtNomPieceConnexe>4;9,piece9</coordEtNomPieceConnexe>
            <coordEtNomPieceConnexe>7;6,piece9</coordEtNomPieceConnexe>
        </sortie>
    </piece>
    
    <piece>
        <nom>piece6</nom>
        <murs>
            <coordonnees>2;0,0;0</coordonnees>  
            <coordonnees>0;0,0;4</coordonnees>
            <coordonnees>0;4,6;4</coordonnees>
            <coordonnees>6;4,6;0</coordonnees>
            <coordonnees>6;0,4;0</coordonnees>             
        </murs>
        <obstacles>
            <obstacle>
                <nom>but</nom>
                <coordonnees>0;2,1;2</coordonnees>  
                <coordonnees>1;2,1;3</coordonnees>
                <coordonnees>1;3,5;3</coordonnees>
                <coordonnees>5;3,5;2</coordonnees>
                <coordonnees>5;2,6;2</coordonnees>  
                <coordonnees>6;2,6;4</coordonnees>
                <coordonnees>6;4,0;4</coordonnees>
                <coordonnees>0;4,0;2</coordonnees>
            </obstacle>      
        </obstacles>
        <sortie>
            <coordEtNomPieceConnexe>3;0,piece5</coordEtNomPieceConnexe>
        </sortie>
    </piece>
    
    <piece>
        <nom>piece8</nom>
        <murs>
            <coordonnees>0;1,0;0</coordonnees>  
            <coordonnees>0;0,7;0</coordonnees>
            <coordonnees>7;0,7;4</coordonnees>
            <coordonnees>7;4,0;4</coordonnees>
            <coordonnees>0;4,0;3</coordonnees>             
        </murs>
        <sortie>
            <coordEtNomPieceConnexe>0;2,piece5</coordEtNomPieceConnexe>
        </sortie>
    </piece>
    
    <piece>
        <nom>piece9</nom>
        <murs>
            <coordonnees>0;2,0;0</coordonnees>  
            <coordonnees>0;0,2;0</coordonnees>
            <coordonnees>4;0,7;0</coordonnees>
            <coordonnees>7;0,7;6</coordonnees>
            <coordonnees>7;6,0;6</coordonnees>   
            <coordonnees>0;6,0;4</coordonnees>            
        </murs>
        <sortie>
            <coordEtNomPieceConnexe>0;3,piece5</coordEtNomPieceConnexe>
            <coordEtNomPieceConnexe>3;0,piece5</coordEtNomPieceConnexe>
        </sortie>
    </piece>
        
  </batiment>
</racine>
