<?xml version="1.0" encoding="UTF-8"?>

<racine xmlns:xsi="http://www.w3.org/2001/XMLSchema-instance" xsi:noNamespaceSchemaLocation="./bp.xsd" >
<batiment>

<nom>Test</nom><piece><nom>Chambre 1</nom>
<murs>
<coordonnees>0;0,6;0</coordonnees>
<coordonnees>6;0,6;5</coordonnees>
<coordonnees>6;5,4;5</coordonnees>
<coordonnees>2;5,0;5</coordonnees>
<coordonnees>0;5,0;0</coordonnees>
</murs>
<sortie>
<coordetnompiececonnexe>3;5,Salon</coordetnompiececonnexe>
</sortie>
</piece>
<piece><nom>Chambre 2</nom>
<murs>
<coordonnees>0;0,6;0</coordonnees>
<coordonnees>6;0,6;5</coordonnees>
<coordonnees>6;5,4;5</coordonnees>
<coordonnees>2;5,0;5</coordonnees>
<coordonnees>0;5,0;0</coordonnees>
</murs>
<sortie>
<coordetnompiececonnexe>3;5,Salon</coordetnompiececonnexe>
</sortie>
</piece>
<piece><nom>Salle de bain</nom>
<murs>
<coordonnees>0;0,6;0</coordonnees>
<coordonnees>6;0,6;5</coordonnees>
<coordonnees>6;5,4;5</coordonnees>
<coordonnees>2;5,0;5</coordonnees>
<coordonnees>0;5,0;0</coordonnees>
</murs>
<sortie>
<coordetnompiececonnexe>3;5,Salon</coordetnompiececonnexe>
</sortie>
</piece>
<piece><nom>Salon</nom>
<murs>
<coordonnees>0;0,2;0</coordonnees>
<coordonnees>4;0,8;0</coordonnees>
<coordonnees>10;0,14;0</coordonnees>
<coordonnees>16;0,18;0</coordonnees>
<coordonnees>18;0,18;5</coordonnees>
<coordonnees>18;5,16;5</coordonnees>
<coordonnees>14;5,12;5</coordonnees>
<coordonnees>12;5,12;7</coordonnees>
<coordonnees>12;9,12;11</coordonnees>
<coordonnees>12;11,5;11</coordonnees>
<coordonnees>5;11,0;6</coordonnees>
<coordonnees>0;6,0;0</coordonnees>
</murs>
<sortie>
<coordetnompiececonnexe>3;0,Chambre 1</coordetnompiececonnexe>
<coordetnompiececonnexe>9;0,Chambre 2</coordetnompiececonnexe>
<coordetnompiececonnexe>15;0,Salle de bain</coordetnompiececonnexe>
<coordetnompiececonnexe>15;5,Cuisine</coordetnompiececonnexe>
<coordetnompiececonnexe>13;8,Cuisine</coordetnompiececonnexe>
</sortie>
</piece>
<piece><nom>Cuisine</nom>
<murs>
<coordonnees>0;0,2;0</coordonnees>
<coordonnees>4;0,6;0</coordonnees>
<coordonnees>6;0,6;6</coordonnees>
<coordonnees>6;6,0;6</coordonnees>
<coordonnees>0;6,0;4</coordonnees>
<coordonnees>0;2,0;0</coordonnees>
</murs>
<obstacles>
</obstacles>
<sortie>
<coordetnompiececonnexe>3;0,Salon</coordetnompiececonnexe>
<coordetnompiececonnexe>0;3,Salon</coordetnompiececonnexe>
</sortie>
</piece>
</batiment>
</racine>