<?xml version="1.0" encoding="UTF-8"?>

<racine xmlns:xsi="http://www.w3.org/2001/XMLSchema-instance" xsi:noNamespaceSchemaLocation="./bp.xsd" >
<batiment>

<nom>Test</nom><piece><nom>piece7</nom>
<murs>
<coordonnees>2;4,0;4</coordonnees>
<coordonnees>0;4,0;0</coordonnees>
<coordonnees>0;0,6;0</coordonnees>
<coordonnees>6;0,6;4</coordonnees>
<coordonnees>6;4,4;4</coordonnees>
</murs>
<sortie>
<coordetnompiececonnexe>3;4,piece5</coordetnompiececonnexe>
</sortie>
</piece>
<piece><nom>piece1</nom>
<murs>
<coordonnees>4;5,0;5</coordonnees>
<coordonnees>0;5,0;0</coordonnees>
<coordonnees>0;0,7;0</coordonnees>
<coordonnees>7;0,7;5</coordonnees>
<coordonnees>7;5,6;5</coordonnees>
</murs>
<obstacles>
</obstacles>
<sortie>
<coordetnompiececonnexe>5;5,piece2</coordetnompiececonnexe>
</sortie>
</piece>
<piece><nom>piece2</nom>
<murs>
<coordonnees>3;0,0;0</coordonnees>
<coordonnees>0;0,0;7</coordonnees>
<coordonnees>0;7,3;7</coordonnees>
<coordonnees>3;7,3;5</coordonnees>
<coordonnees>3;5,4;5</coordonnees>
<coordonnees>6;5,6;3</coordonnees>
<coordonnees>6;1,6;0</coordonnees>
<coordonnees>6;0,5;0</coordonnees>
</murs>
<obstacles>
</obstacles>
<sortie>
<coordetnompiececonnexe>4;0,piece1</coordetnompiececonnexe>
<coordetnompiececonnexe>5;5,piece3</coordetnompiececonnexe>
<coordetnompiececonnexe>6;2,piece4</coordetnompiececonnexe>
</sortie>
</piece>
<piece><nom>piece4</nom>
<murs>
<coordonnees>0;1,0;0</coordonnees>
<coordonnees>0;0,1;0</coordonnees>
<coordonnees>3;0,4;0</coordonnees>
<coordonnees>4;0,4;9</coordonnees>
<coordonnees>4;9,1;9</coordonnees>
<coordonnees>1;9,1;5</coordonnees>
<coordonnees>1;5,0;5</coordonnees>
<coordonnees>0;5,0;3</coordonnees>
</murs>
<obstacles>
</obstacles>
<sortie>
<coordetnompiececonnexe>0;2,piece2</coordetnompiececonnexe>
<coordetnompiececonnexe>2;0,piece5</coordetnompiececonnexe>
</sortie>
</piece>
<piece><nom>piece3</nom>
<murs>
<coordonnees>1;0,0;0</coordonnees>
<coordonnees>0;0,0;4</coordonnees>
<coordonnees>0;4,3;4</coordonnees>
<coordonnees>3;4,3;0</coordonnees>
</murs>
<sortie>
<coordetnompiececonnexe>2;0,piece2</coordetnompiececonnexe>
</sortie>
</piece>
<piece><nom>piece5</nom>
<murs>
<coordonnees>0;0,4;0</coordonnees>
<coordonnees>4;0,4;1</coordonnees>
<coordonnees>4;3,4;4</coordonnees>
<coordonnees>4;4,11;4</coordonnees>
<coordonnees>11;4,11;6</coordonnees>
<coordonnees>11;6,8;6</coordonnees>
<coordonnees>6;6,4;6</coordonnees>
<coordonnees>4;6,4;8</coordonnees>
<coordonnees>4;10,4;15</coordonnees>
<coordonnees>4;15,3;15</coordonnees>
<coordonnees>1;15,0;15</coordonnees>
<coordonnees>0;15,0;6</coordonnees>
<coordonnees>0;6,-2;6</coordonnees>
<coordonnees>-4;6,-6;6</coordonnees>
<coordonnees>-6;6,-6;4</coordonnees>
<coordonnees>-6;4,-4;4</coordonnees>
<coordonnees>-2;4,0;4</coordonnees>
<coordonnees>0;4,0;0</coordonnees>
</murs>
<sortie>
<coordetnompiececonnexe>2;15,piece4</coordetnompiececonnexe>
<coordetnompiececonnexe>-3;6,piece6</coordetnompiececonnexe>
<coordetnompiececonnexe>-3;4,piece7</coordetnompiececonnexe>
<coordetnompiececonnexe>4;2,piece8</coordetnompiececonnexe>
<coordetnompiececonnexe>4;9,piece9</coordetnompiececonnexe>
<coordetnompiececonnexe>7;6,piece9</coordetnompiececonnexe>
</sortie>
</piece>
<piece><nom>piece6</nom>
<murs>
<coordonnees>2;0,0;0</coordonnees>
<coordonnees>0;0,0;4</coordonnees>
<coordonnees>0;4,6;4</coordonnees>
<coordonnees>6;4,6;0</coordonnees>
<coordonnees>6;0,4;0</coordonnees>
</murs>
<obstacles>
</obstacles>
<sortie>
<coordetnompiececonnexe>3;0,piece5</coordetnompiececonnexe>
</sortie>
</piece>
<piece><nom>piece8</nom>
<murs>
<coordonnees>0;1,0;0</coordonnees>
<coordonnees>0;0,7;0</coordonnees>
<coordonnees>7;0,7;4</coordonnees>
<coordonnees>7;4,0;4</coordonnees>
<coordonnees>0;4,0;3</coordonnees>
</murs>
<sortie>
<coordetnompiececonnexe>0;2,piece5</coordetnompiececonnexe>
</sortie>
</piece>
<piece><nom>piece9</nom>
<murs>
<coordonnees>0;2,0;0</coordonnees>
<coordonnees>0;0,2;0</coordonnees>
<coordonnees>4;0,7;0</coordonnees>
<coordonnees>7;0,7;6</coordonnees>
<coordonnees>7;6,0;6</coordonnees>
<coordonnees>0;6,0;4</coordonnees>
</murs>
<sortie>
<coordetnompiececonnexe>0;3,piece5</coordetnompiececonnexe>
<coordetnompiececonnexe>3;0,piece5</coordetnompiececonnexe>
</sortie>
</piece>
</batiment>
</racine>